weight,name,tags,path
0,Margin of error for Households,public assistance|disability|families,data/columns/us/census/acs/B22010/moe/B22010001.json
0,Margin of error for Household received Food Stamps/SNAP in the past 12 months,public assistance|disability|families,data/columns/us/census/acs/B22010/moe/B22010002.json
0,Margin of error for Households with 1 or more persons with a disability Household received Food Stamps/SNAP in the past 12 months Receipt of Food Stamps/SNAP in the Past 12 Months,public assistance|disability|families,data/columns/us/census/acs/B22010/moe/B22010003.json
0,Margin of error for Households with no persons with a disability Household received Food Stamps/SNAP in the past 12 months Receipt of Food Stamps/SNAP in the Past 12 Months,public assistance|disability|families,data/columns/us/census/acs/B22010/moe/B22010004.json
0,Margin of error for Household did not receive Food Stamps/SNAP in the past 12 months,public assistance|disability|families,data/columns/us/census/acs/B22010/moe/B22010005.json
0,Margin of error for Households with 1 or more persons with a disability Household did not receive Food Stamps/SNAP in the past 12 months Receipt of Food Stamps/SNAP in the Past 12 Months,public assistance|disability|families,data/columns/us/census/acs/B22010/moe/B22010006.json
0,Margin of error for Households with no persons with a disability Household did not receive Food Stamps/SNAP in the past 12 months Receipt of Food Stamps/SNAP in the Past 12 Months,public assistance|disability|families,data/columns/us/census/acs/B22010/moe/B22010007.json
