weight,name,tags,path
0,Margin of error for Asian Alone Population 1 Year and Over in the United States,race|migration,data/columns/us/census/acs/B07004D/moe/B07004D001.json
0,Margin of error for Same house 1 year ago in Asian Alone Population 1 Year and Over,race|migration,data/columns/us/census/acs/B07004D/moe/B07004D002.json
0,Margin of error for Moved within same county in Asian Alone Population 1 Year and Over,race|migration,data/columns/us/census/acs/B07004D/moe/B07004D003.json
0,Margin of error for Moved from different county within same state in Asian Alone Population 1 Year and Over,race|migration,data/columns/us/census/acs/B07004D/moe/B07004D004.json
0,Margin of error for Moved from different state in Asian Alone Population 1 Year and Over,race|migration,data/columns/us/census/acs/B07004D/moe/B07004D005.json
0,Margin of error for Moved from abroad in Asian Alone Population 1 Year and Over,race|migration,data/columns/us/census/acs/B07004D/moe/B07004D006.json
