weight,name,tags,path
0,Hispanic or Latino Population 5 Years and Over,race|language,data/columns/us/census/acs/C16006/C16006001.json
0,Speak only English in Hispanic or Latino Population 5 Years and Over,race|language,data/columns/us/census/acs/C16006/C16006002.json
0,Speak Spanish in Hispanic or Latino Population 5 Years and Over,race|language,data/columns/us/census/acs/C16006/C16006003.json
0,"Speak English ""very well"" Speak Spanish Language Spoken at Home in Hispanic or Latino Population 5 Years and Over",race|language,data/columns/us/census/acs/C16006/C16006004.json
0,"Speak English less than ""very well"" Speak Spanish Language Spoken at Home in Hispanic or Latino Population 5 Years and Over",race|language,data/columns/us/census/acs/C16006/C16006005.json
0,Speak other language in Hispanic or Latino Population 5 Years and Over,race|language,data/columns/us/census/acs/C16006/C16006006.json
