weight,name,tags,path
0,Margin of error for Total Population in Puerto Rico,place of birth|citizenship,data/columns/us/census/acs/B05001PR/moe/B05001PR001.json
0,"Margin of error for U.S. citizen, born in Puerto Rico in Population in Puerto Rico",place of birth|citizenship,data/columns/us/census/acs/B05001PR/moe/B05001PR002.json
0,"Margin of error for U.S. citizen, born in U.S. or U.S. Island Areas in Population in Puerto Rico",place of birth|citizenship,data/columns/us/census/acs/B05001PR/moe/B05001PR003.json
0,"Margin of error for U.S. citizen, born abroad of American parent(s) in Population in Puerto Rico",place of birth|citizenship,data/columns/us/census/acs/B05001PR/moe/B05001PR004.json
0,Margin of error for U.S. citizen by naturalization in Population in Puerto Rico,place of birth|citizenship,data/columns/us/census/acs/B05001PR/moe/B05001PR005.json
0,Margin of error for Not a U.S. citizen in Population in Puerto Rico,place of birth|citizenship,data/columns/us/census/acs/B05001PR/moe/B05001PR006.json
