weight,name,tags,path
1,Vacant Housing Units,housing|occupancy,data/columns/us/census/acs/B25004/B25004001.json
1,For rent in Vacant Housing Units,housing|occupancy,data/columns/us/census/acs/B25004/B25004002.json
1,"Rented, not occupied in Vacant Housing Units",housing|occupancy,data/columns/us/census/acs/B25004/B25004003.json
1,For sale only in Vacant Housing Units,housing|occupancy,data/columns/us/census/acs/B25004/B25004004.json
1,"Sold, not occupied in Vacant Housing Units",housing|occupancy,data/columns/us/census/acs/B25004/B25004005.json
1,"For seasonal, recreational, or occasional use in Vacant Housing Units",housing|occupancy,data/columns/us/census/acs/B25004/B25004006.json
1,For migrant workers in Vacant Housing Units,housing|occupancy,data/columns/us/census/acs/B25004/B25004007.json
1,Other vacant in Vacant Housing Units,housing|occupancy,data/columns/us/census/acs/B25004/B25004008.json
