weight,name,tags,path
0,Margin of error for Some Other Race Alone Population in the United States,place of birth|race,data/columns/us/census/acs/B06004F/moe/B06004F001.json
0,Margin of error for Born in state of residence in Some Other Race Alone Population,place of birth|race,data/columns/us/census/acs/B06004F/moe/B06004F002.json
0,Margin of error for Born in other state in the United States in Some Other Race Alone Population,place of birth|race,data/columns/us/census/acs/B06004F/moe/B06004F003.json
0,Margin of error for Native; born outside the United States in Some Other Race Alone Population,place of birth|race,data/columns/us/census/acs/B06004F/moe/B06004F004.json
0,Margin of error for Foreign born in Some Other Race Alone Population,place of birth|race,data/columns/us/census/acs/B06004F/moe/B06004F005.json
