weight,name,tags,path
0,Margin of error for Civilian Employed Population 16 Years and Over With Earnings,employment|income,data/columns/us/census/acs/B24081/moe/B24081001.json
0,Margin of error for Private for-profit wage and salary workers in Civilian Employed Population 16 Years and Over With Earnings,employment|income,data/columns/us/census/acs/B24081/moe/B24081002.json
0,Margin of error for Employee of private company workers Private for-profit wage and salary workers Class of Worker in Civilian Employed Population 16 Years and Over With Earnings,employment|income,data/columns/us/census/acs/B24081/moe/B24081003.json
0,Margin of error for Self-employed in own incorporated business workers Private for-profit wage and salary workers Class of Worker in Civilian Employed Population 16 Years and Over With Earnings,employment|income,data/columns/us/census/acs/B24081/moe/B24081004.json
0,Margin of error for Private not-for-profit wage and salary workers in Civilian Employed Population 16 Years and Over With Earnings,employment|income,data/columns/us/census/acs/B24081/moe/B24081005.json
0,Margin of error for Local government workers in Civilian Employed Population 16 Years and Over With Earnings,employment|income,data/columns/us/census/acs/B24081/moe/B24081006.json
0,Margin of error for State government workers in Civilian Employed Population 16 Years and Over With Earnings,employment|income,data/columns/us/census/acs/B24081/moe/B24081007.json
0,Margin of error for Federal government workers in Civilian Employed Population 16 Years and Over With Earnings,employment|income,data/columns/us/census/acs/B24081/moe/B24081008.json
0,Margin of error for Self-employed in own not incorporated business workers and unpaid family workers in Civilian Employed Population 16 Years and Over With Earnings,employment|income,data/columns/us/census/acs/B24081/moe/B24081009.json
