weight,name,tags,path
0,Population 15 Years and Over in the United States With Income,migration|income,data/columns/us/census/acs/B07411/B07411001.json
0,Same house,migration|income,data/columns/us/census/acs/B07411/B07411002.json
0,Moved within same county,migration|income,data/columns/us/census/acs/B07411/B07411003.json
0,Moved to different county within same state,migration|income,data/columns/us/census/acs/B07411/B07411004.json
0,Moved to different state,migration|income,data/columns/us/census/acs/B07411/B07411005.json
