weight,name,tags,path
0,Margin of error for Population 15 Years and Over With Income in the Past 12 Months,migration|income,data/columns/us/census/acs/B07411PR/moe/B07411PR001.json
0,Margin of error for Same house,migration|income,data/columns/us/census/acs/B07411PR/moe/B07411PR002.json
0,Margin of error for Moved within same municipio,migration|income,data/columns/us/census/acs/B07411PR/moe/B07411PR003.json
0,Margin of error for Moved to different municipio,migration|income,data/columns/us/census/acs/B07411PR/moe/B07411PR004.json
0,Margin of error for Moved to the United States,migration|income,data/columns/us/census/acs/B07411PR/moe/B07411PR005.json
