weight,name,tags,path
0,Margin of error for Asian Alone Population 1 Year and Over,race|migration,data/columns/us/census/acs/B07404DPR/moe/B07404DPR001.json
0,Margin of error for Same house in Asian Alone Population 1 Year and Over,race|migration,data/columns/us/census/acs/B07404DPR/moe/B07404DPR002.json
0,Margin of error for Moved within same municipio in Asian Alone Population 1 Year and Over,race|migration,data/columns/us/census/acs/B07404DPR/moe/B07404DPR003.json
0,Margin of error for Moved to different municipio in Asian Alone Population 1 Year and Over,race|migration,data/columns/us/census/acs/B07404DPR/moe/B07404DPR004.json
0,Margin of error for Moved to the United States in Asian Alone Population 1 Year and Over,race|migration,data/columns/us/census/acs/B07404DPR/moe/B07404DPR005.json
