weight,name,tags,path
0,Population 16 Years and Over,technical|employment,data/columns/us/census/acs/B99233/B99233001.json
0,Worked in the past 12 months in Population 16 Years and Over,technical|employment,data/columns/us/census/acs/B99233/B99233002.json
0,Imputed Worked in the past 12 months Imputation of Usual Hours Worked Per Week in the Past 12 Months in Population 16 Years and Over,technical|employment,data/columns/us/census/acs/B99233/B99233003.json
0,Not imputed Worked in the past 12 months Imputation of Usual Hours Worked Per Week in the Past 12 Months in Population 16 Years and Over,technical|employment,data/columns/us/census/acs/B99233/B99233004.json
0,Did not work in the past 12 months in Population 16 Years and Over,technical|employment,data/columns/us/census/acs/B99233/B99233005.json
