weight,name,tags,path
0,Margin of error for White Alone Workers 16 Years and Over,commute|employment|race,data/columns/us/census/acs/C08505A/moe/C08505A001.json
0,"Margin of error for Car, truck, or van - drove alone in White Alone Workers 16 Years and Over",commute|employment|race,data/columns/us/census/acs/C08505A/moe/C08505A002.json
0,"Margin of error for Car, truck, or van - carpooled in White Alone Workers 16 Years and Over",commute|employment|race,data/columns/us/census/acs/C08505A/moe/C08505A003.json
0,Margin of error for Public transportation (excluding taxicab) in White Alone Workers 16 Years and Over,commute|employment|race,data/columns/us/census/acs/C08505A/moe/C08505A004.json
0,"Margin of error for Taxicab, motorcycle, bicycle, walked, or other means in White Alone Workers 16 Years and Over",commute|employment|race,data/columns/us/census/acs/C08505A/moe/C08505A005.json
0,Margin of error for Worked at home in White Alone Workers 16 Years and Over,commute|employment|race,data/columns/us/census/acs/C08505A/moe/C08505A006.json
