weight,name,tags,path
0,Owner-occupied Housing Units,technical|costs and value|mortgage,data/columns/us/census/acs/B992522/B992522001.json
0,Housing units with a mortgage in Owner-occupied Housing Units,technical|costs and value|mortgage,data/columns/us/census/acs/B992522/B992522002.json
0,One or more items imputed Housing units with a mortgage Imputation of Mortgage Status and Selected Monthly Owner Costs in Owner-occupied Housing Units,technical|costs and value|mortgage,data/columns/us/census/acs/B992522/B992522003.json
0,No items imputed Housing units with a mortgage Imputation of Mortgage Status and Selected Monthly Owner Costs in Owner-occupied Housing Units,technical|costs and value|mortgage,data/columns/us/census/acs/B992522/B992522004.json
0,Housing units without a mortgage in Owner-occupied Housing Units,technical|costs and value|mortgage,data/columns/us/census/acs/B992522/B992522005.json
0,One or more items imputed Housing units without a mortgage Imputation of Mortgage Status and Selected Monthly Owner Costs in Owner-occupied Housing Units,technical|costs and value|mortgage,data/columns/us/census/acs/B992522/B992522006.json
0,No items imputed Housing units without a mortgage Imputation of Mortgage Status and Selected Monthly Owner Costs in Owner-occupied Housing Units,technical|costs and value|mortgage,data/columns/us/census/acs/B992522/B992522007.json
