weight,name,tags,path
0,Margin of error for American Indian and Alaska Native Alone Household Population,health insurance|race|families,data/columns/us/census/acs/B28009C/moe/B28009C001.json
0,Margin of error for Has a computer in American Indian and Alaska Native Alone Household Population,health insurance|race|families,data/columns/us/census/acs/B28009C/moe/B28009C002.json
0,Margin of error for With dial-up Internet subscription alone Has a computer Presence of a Computer and Type of Internet Subscription in Household (American Indian and Alaska Native Alone) in American Indian and Alaska Native Alone Household Population,health insurance|race|families,data/columns/us/census/acs/B28009C/moe/B28009C003.json
0,Margin of error for With a broadband Internet subscription Has a computer Presence of a Computer and Type of Internet Subscription in Household (American Indian and Alaska Native Alone) in American Indian and Alaska Native Alone Household Population,health insurance|race|families,data/columns/us/census/acs/B28009C/moe/B28009C004.json
0,Margin of error for Without an Internet subscription Has a computer Presence of a Computer and Type of Internet Subscription in Household (American Indian and Alaska Native Alone) in American Indian and Alaska Native Alone Household Population,health insurance|race|families,data/columns/us/census/acs/B28009C/moe/B28009C005.json
0,Margin of error for No Computer in American Indian and Alaska Native Alone Household Population,health insurance|race|families,data/columns/us/census/acs/B28009C/moe/B28009C006.json
