weight,name,tags,path
0,White Alone Population 1 Year and Over,race|migration,data/columns/us/census/acs/B07404A/B07404A001.json
0,Same house in White Alone Population 1 Year and Over,race|migration,data/columns/us/census/acs/B07404A/B07404A002.json
0,Moved within same county in White Alone Population 1 Year and Over,race|migration,data/columns/us/census/acs/B07404A/B07404A003.json
0,Moved to different county within same state in White Alone Population 1 Year and Over,race|migration,data/columns/us/census/acs/B07404A/B07404A004.json
0,Moved to different state in White Alone Population 1 Year and Over,race|migration,data/columns/us/census/acs/B07404A/B07404A005.json
