weight,name,tags,path
0,Margin of error for Foreign-born Population,place of birth|citizenship,data/columns/us/census/acs/C05011/moe/C05011001.json
0,Margin of error for Not a U.S. citizen in Foreign-born Population,place of birth|citizenship,data/columns/us/census/acs/C05011/moe/C05011002.json
0,Margin of error for Naturalized citizens in Foreign-born Population,place of birth|citizenship,data/columns/us/census/acs/C05011/moe/C05011003.json
0,Margin of error for Naturalized 2000 or later Naturalized citizens Period of Naturalization in Foreign-born Population,place of birth|citizenship,data/columns/us/census/acs/C05011/moe/C05011004.json
0,Margin of error for Naturalized 1985 to 1999 Naturalized citizens Period of Naturalization in Foreign-born Population,place of birth|citizenship,data/columns/us/census/acs/C05011/moe/C05011005.json
0,Margin of error for Naturalized before 1985 Naturalized citizens Period of Naturalization in Foreign-born Population,place of birth|citizenship,data/columns/us/census/acs/C05011/moe/C05011006.json
