weight,name,tags,path
0,Margin of error for Aggregate earnings in the past 12 months (in 2011 inflation-adjusted dollars),sex|employment|income,data/columns/us/census/acs/B20003/moe/B20003001.json
0,Margin of error for Male,sex|employment|income,data/columns/us/census/acs/B20003/moe/B20003002.json
0,"Margin of error for Worked full-time, year-round in the past 12 months Male Aggregate Earnings in the Past 12 Months (In 2011 Inflation-adjusted Dollars)",sex|employment|income,data/columns/us/census/acs/B20003/moe/B20003003.json
0,Margin of error for Other Male Aggregate Earnings in the Past 12 Months (In 2011 Inflation-adjusted Dollars),sex|employment|income,data/columns/us/census/acs/B20003/moe/B20003004.json
0,Margin of error for Female,sex|employment|income,data/columns/us/census/acs/B20003/moe/B20003005.json
0,"Margin of error for Worked full-time, year-round in the past 12 months Female Aggregate Earnings in the Past 12 Months (In 2011 Inflation-adjusted Dollars)",sex|employment|income,data/columns/us/census/acs/B20003/moe/B20003006.json
0,Margin of error for Other Female Aggregate Earnings in the Past 12 Months (In 2011 Inflation-adjusted Dollars),sex|employment|income,data/columns/us/census/acs/B20003/moe/B20003007.json
