weight,name,tags,path
0,Aggregate travel time to work (in minutes),commute|employment,data/columns/us/census/acs/B08131/B08131001.json
0,Worked in State of residence,commute|employment,data/columns/us/census/acs/B08131/B08131002.json
0,Worked in county of residence Worked in State of residence Aggregate Travel Time to Work (In Minutes) of Workers,commute|employment,data/columns/us/census/acs/B08131/B08131003.json
0,Worked outside county of residence Worked in State of residence Aggregate Travel Time to Work (In Minutes) of Workers,commute|employment,data/columns/us/census/acs/B08131/B08131004.json
0,Worked outside State of residence,commute|employment,data/columns/us/census/acs/B08131/B08131005.json
