weight,name,tags,path
0,Population 1 Year and Over,technical,data/columns/us/census/acs/B99072/B99072001.json
0,Different house in Population 1 Year and Over,technical,data/columns/us/census/acs/B99072/B99072002.json
0,Imputed Different house Imputation of Residence 1 Year Ago in Population 1 Year and Over,technical,data/columns/us/census/acs/B99072/B99072003.json
0,One or more but not all geographic parts imputed Different house Imputation of Residence 1 Year Ago Imputed in Population 1 Year and Over,technical,data/columns/us/census/acs/B99072/B99072004.json
0,All geographic parts imputed Different house Imputation of Residence 1 Year Ago Imputed in Population 1 Year and Over,technical,data/columns/us/census/acs/B99072/B99072005.json
0,Not imputed Different house Imputation of Residence 1 Year Ago in Population 1 Year and Over,technical,data/columns/us/census/acs/B99072/B99072006.json
0,Same house in Population 1 Year and Over,technical,data/columns/us/census/acs/B99072/B99072007.json
