weight,name,tags,path
0,Population Born Outside the United States,technical,data/columns/us/census/acs/B99052/B99052001.json
0,Native in Population Born Outside the United States,technical,data/columns/us/census/acs/B99052/B99052002.json
0,Imputed Native Imputation of Year of Entry in Population Born Outside the United States,technical,data/columns/us/census/acs/B99052/B99052003.json
0,Not imputed Native Imputation of Year of Entry in Population Born Outside the United States,technical,data/columns/us/census/acs/B99052/B99052004.json
0,Foreign born in Population Born Outside the United States,technical,data/columns/us/census/acs/B99052/B99052005.json
0,Imputed Foreign born Imputation of Year of Entry in Population Born Outside the United States,technical,data/columns/us/census/acs/B99052/B99052006.json
0,Not imputed Foreign born Imputation of Year of Entry in Population Born Outside the United States,technical,data/columns/us/census/acs/B99052/B99052007.json
