weight,name,tags,path
1,Margin of error for Lowest Quintile in Households,families|income,data/columns/us/census/acs/B19080/moe/B19080001.json
1,Margin of error for Second Quintile in Households,families|income,data/columns/us/census/acs/B19080/moe/B19080002.json
1,Margin of error for Third Quintile in Households,families|income,data/columns/us/census/acs/B19080/moe/B19080003.json
1,Margin of error for Fourth Quintile in Households,families|income,data/columns/us/census/acs/B19080/moe/B19080004.json
1,Margin of error for Lower Limit of Top 5 Percent in Households,families|income,data/columns/us/census/acs/B19080/moe/B19080005.json
