weight,name,tags,path
0,Civilian Employed Population 16 Years and Over With Earnings,employment|income,data/columns/us/census/acs/B24081/B24081001.json
0,Private for-profit wage and salary workers in Civilian Employed Population 16 Years and Over With Earnings,employment|income,data/columns/us/census/acs/B24081/B24081002.json
0,Employee of private company workers Private for-profit wage and salary workers Class of Worker in Civilian Employed Population 16 Years and Over With Earnings,employment|income,data/columns/us/census/acs/B24081/B24081003.json
0,Self-employed in own incorporated business workers Private for-profit wage and salary workers Class of Worker in Civilian Employed Population 16 Years and Over With Earnings,employment|income,data/columns/us/census/acs/B24081/B24081004.json
0,Private not-for-profit wage and salary workers in Civilian Employed Population 16 Years and Over With Earnings,employment|income,data/columns/us/census/acs/B24081/B24081005.json
0,Local government workers in Civilian Employed Population 16 Years and Over With Earnings,employment|income,data/columns/us/census/acs/B24081/B24081006.json
0,State government workers in Civilian Employed Population 16 Years and Over With Earnings,employment|income,data/columns/us/census/acs/B24081/B24081007.json
0,Federal government workers in Civilian Employed Population 16 Years and Over With Earnings,employment|income,data/columns/us/census/acs/B24081/B24081008.json
0,Self-employed in own not incorporated business workers and unpaid family workers in Civilian Employed Population 16 Years and Over With Earnings,employment|income,data/columns/us/census/acs/B24081/B24081009.json
