weight,name,tags,path
0,Margin of error for Civilian Population 18 Years and Over With Income in the Past 12 Months,sex|veterans|income,data/columns/us/census/acs/B21004/moe/B21004001.json
0,Margin of error for Veteran,sex|veterans|income,data/columns/us/census/acs/B21004/moe/B21004002.json
0,Margin of error for Male Veteran Median Income in the Past 12 Months (In 2011 Inflation-adjusted Dollars),sex|veterans|income,data/columns/us/census/acs/B21004/moe/B21004003.json
0,Margin of error for Female Veteran Median Income in the Past 12 Months (In 2011 Inflation-adjusted Dollars),sex|veterans|income,data/columns/us/census/acs/B21004/moe/B21004004.json
0,Margin of error for Nonveteran,sex|veterans|income,data/columns/us/census/acs/B21004/moe/B21004005.json
0,Margin of error for Male Nonveteran Median Income in the Past 12 Months (In 2011 Inflation-adjusted Dollars),sex|veterans|income,data/columns/us/census/acs/B21004/moe/B21004006.json
0,Margin of error for Female Nonveteran Median Income in the Past 12 Months (In 2011 Inflation-adjusted Dollars),sex|veterans|income,data/columns/us/census/acs/B21004/moe/B21004007.json
