weight,name,tags,path
0,Margin of error for Workers 16 Years and Over,age|commute|employment,data/columns/us/census/acs/B08503/moe/B08503001.json
0,"Margin of error for Car, truck, or van - drove alone",age|commute|employment,data/columns/us/census/acs/B08503/moe/B08503002.json
0,"Margin of error for Car, truck, or van - carpooled",age|commute|employment,data/columns/us/census/acs/B08503/moe/B08503003.json
0,Margin of error for Public transportation (excluding taxicab),age|commute|employment,data/columns/us/census/acs/B08503/moe/B08503004.json
0,Margin of error for Walked,age|commute|employment,data/columns/us/census/acs/B08503/moe/B08503005.json
0,"Margin of error for Taxicab, motorcycle, bicycle, or other means",age|commute|employment,data/columns/us/census/acs/B08503/moe/B08503006.json
0,Margin of error for Worked at home,age|commute|employment,data/columns/us/census/acs/B08503/moe/B08503007.json
